{
    "maxVersionMajor": 1,
    "maxVersionMinor": 20,
    "maxVersionPatch": 70,
    "maxVersionRevision": 4,
    "renamedIds": {
        "minecraft:grass": "minecraft:grass_block"
    },
    "flattenedProperties": {
        "minecraft:double_wooden_slab": {
            "prefix": "minecraft:",
            "flattenedProperty": "wood_type",
            "suffix": "_double_slab"
        },
        "minecraft:leaves": {
            "prefix": "minecraft:",
            "flattenedProperty": "old_leaf_type",
            "suffix": "_leaves"
        },
        "minecraft:leaves2": {
            "prefix": "minecraft:",
            "flattenedProperty": "new_leaf_type",
            "suffix": "_leaves"
        },
        "minecraft:wooden_slab": {
            "prefix": "minecraft:",
            "flattenedProperty": "wood_type",
            "suffix": "_slab"
        }
    },
    "remappedStates": {
        "minecraft:wood": [
            {
                "oldState": {
                    "stripped_bit": {
                        "byte": 0
                    }
                },
                "newFlattenedName": {
                    "prefix": "minecraft:",
                    "flattenedProperty": "wood_type",
                    "suffix": "_wood"
                },
                "newState": null,
                "copiedState": [
                    "pillar_axis"
                ]
            },
            {
                "oldState": {
                    "stripped_bit": {
                        "byte": 1
                    }
                },
                "newFlattenedName": {
                    "prefix": "minecraft:stripped_",
                    "flattenedProperty": "wood_type",
                    "suffix": "_wood"
                },
                "newState": null,
                "copiedState": [
                    "pillar_axis"
                ]
            }
        ]
    }
}
