{
    "maxVersionMajor": 1,
    "maxVersionMinor": 20,
    "maxVersionPatch": 80,
    "maxVersionRevision": 3,
    "removedProperties": {
        "minecraft:bamboo_sapling": [
            "sapling_type"
        ]
    },
    "flattenedProperties": {
        "minecraft:coral_fan": {
            "prefix": "minecraft:",
            "flattenedProperty": "coral_color",
            "suffix": "_coral_fan",
            "flattenedValueRemaps": {
                "blue": "tube",
                "pink": "brain",
                "purple": "bubble",
                "red": "fire",
                "yellow": "horn"
            }
        },
        "minecraft:coral_fan_dead": {
            "prefix": "minecraft:dead_",
            "flattenedProperty": "coral_color",
            "suffix": "_coral_fan",
            "flattenedValueRemaps": {
                "blue": "tube",
                "pink": "brain",
                "purple": "bubble",
                "red": "fire",
                "yellow": "horn"
            }
        },
        "minecraft:red_flower": {
            "prefix": "minecraft:",
            "flattenedProperty": "flower_type",
            "suffix": "",
            "flattenedValueRemaps": {
                "houstonia": "azure_bluet",
                "orchid": "blue_orchid",
                "oxeye": "oxeye_daisy",
                "tulip_orange": "orange_tulip",
                "tulip_pink": "pink_tulip",
                "tulip_red": "red_tulip",
                "tulip_white": "white_tulip"
            }
        },
        "minecraft:sapling": {
            "prefix": "minecraft:",
            "flattenedProperty": "sapling_type",
            "suffix": "_sapling"
        }
    }
}
