{
    "maxVersionMajor": 1,
    "maxVersionMinor": 20,
    "maxVersionPatch": 60,
    "maxVersionRevision": 1,
    "flattenedProperties": {
        "minecraft:hard_stained_glass": {
            "prefix": "minecraft:hard_",
            "flattenedProperty": "color",
            "suffix": "_stained_glass",
            "flattenedValueRemaps": {
                "silver": "light_gray"
            }
        },
        "minecraft:hard_stained_glass_pane": {
            "prefix": "minecraft:hard_",
            "flattenedProperty": "color",
            "suffix": "_stained_glass_pane",
            "flattenedValueRemaps": {
                "silver": "light_gray"
            }
        }
    }
}
