{
    "maxVersionMajor": 1,
    "maxVersionMinor": 21,
    "maxVersionPatch": 20,
    "maxVersionRevision": 6,
    "renamedIds": {
        "minecraft:yellow_flower": "minecraft:dandelion"
    },
    "removedProperties": {
        "minecraft:coral_fan_hang3": [
            "coral_hang_type_bit"
        ]
    },
    "flattenedProperties": {
        "minecraft:anvil": {
            "prefix": "minecraft:",
            "flattenedProperty": "damage",
            "suffix": "anvil",
            "flattenedValueRemaps": {
                "broken": "deprecated_",
                "slightly_damaged": "chipped_",
                "undamaged": "",
                "very_damaged": "damaged_"
            }
        },
        "minecraft:coral_fan_hang3": {
            "prefix": "minecraft:",
            "flattenedProperty": "dead_bit",
            "flattenedPropertyType": "byte",
            "suffix": "horn_coral_wall_fan",
            "flattenedValueRemaps": {
                "0": "",
                "1": "dead_",
                "dummy": "map_not_list"
            }
        },
        "minecraft:dirt": {
            "prefix": "minecraft:",
            "flattenedProperty": "dirt_type",
            "suffix": "dirt",
            "flattenedValueRemaps": {
                "coarse": "coarse_",
                "normal": ""
            }
        },
        "minecraft:double_stone_block_slab": {
            "prefix": "minecraft:",
            "flattenedProperty": "stone_slab_type",
            "suffix": "_double_slab",
            "flattenedValueRemaps": {
                "wood": "petrified_oak"
            }
        },
        "minecraft:double_stone_block_slab2": {
            "prefix": "minecraft:",
            "flattenedProperty": "stone_slab_type_2",
            "suffix": "_double_slab",
            "flattenedValueRemaps": {
                "prismarine_dark": "dark_prismarine",
                "prismarine_rough": "prismarine"
            }
        },
        "minecraft:double_stone_block_slab3": {
            "prefix": "minecraft:",
            "flattenedProperty": "stone_slab_type_3",
            "suffix": "_double_slab"
        },
        "minecraft:double_stone_block_slab4": {
            "prefix": "minecraft:",
            "flattenedProperty": "stone_slab_type_4",
            "suffix": "_double_slab",
            "flattenedValueRemaps": {
                "stone": "normal_stone"
            }
        },
        "minecraft:light_block": {
            "prefix": "minecraft:light_block_",
            "flattenedProperty": "block_light_level",
            "flattenedPropertyType": "int",
            "suffix": ""
        },
        "minecraft:monster_egg": {
            "prefix": "minecraft:infested_",
            "flattenedProperty": "monster_egg_stone_type",
            "suffix": "",
            "flattenedValueRemaps": {
                "chiseled_stone_brick": "chiseled_stone_bricks",
                "cracked_stone_brick": "cracked_stone_bricks",
                "mossy_stone_brick": "mossy_stone_bricks",
                "stone_brick": "stone_bricks"
            }
        },
        "minecraft:prismarine": {
            "prefix": "minecraft:",
            "flattenedProperty": "prismarine_block_type",
            "suffix": "",
            "flattenedValueRemaps": {
                "bricks": "prismarine_bricks",
                "dark": "dark_prismarine",
                "default": "prismarine"
            }
        },
        "minecraft:quartz_block": {
            "prefix": "minecraft:",
            "flattenedProperty": "chisel_type",
            "suffix": "",
            "flattenedValueRemaps": {
                "chiseled": "chiseled_quartz_block",
                "default": "quartz_block",
                "lines": "quartz_pillar",
                "smooth": "smooth_quartz"
            }
        },
        "minecraft:red_sandstone": {
            "prefix": "minecraft:",
            "flattenedProperty": "sand_stone_type",
            "suffix": "red_sandstone",
            "flattenedValueRemaps": {
                "cut": "cut_",
                "default": "",
                "heiroglyphs": "chiseled_",
                "smooth": "smooth_"
            }
        },
        "minecraft:sand": {
            "prefix": "minecraft:",
            "flattenedProperty": "sand_type",
            "suffix": "sand",
            "flattenedValueRemaps": {
                "normal": "",
                "red": "red_"
            }
        },
        "minecraft:sandstone": {
            "prefix": "minecraft:",
            "flattenedProperty": "sand_stone_type",
            "suffix": "sandstone",
            "flattenedValueRemaps": {
                "cut": "cut_",
                "default": "",
                "heiroglyphs": "chiseled_",
                "smooth": "smooth_"
            }
        },
        "minecraft:stone_block_slab2": {
            "prefix": "minecraft:",
            "flattenedProperty": "stone_slab_type_2",
            "suffix": "_slab",
            "flattenedValueRemaps": {
                "prismarine_dark": "dark_prismarine",
                "prismarine_rough": "prismarine"
            }
        },
        "minecraft:stone_block_slab3": {
            "prefix": "minecraft:",
            "flattenedProperty": "stone_slab_type_3",
            "suffix": "_slab"
        },
        "minecraft:stone_block_slab4": {
            "prefix": "minecraft:",
            "flattenedProperty": "stone_slab_type_4",
            "suffix": "_slab",
            "flattenedValueRemaps": {
                "stone": "normal_stone"
            }
        },
        "minecraft:stonebrick": {
            "prefix": "minecraft:",
            "flattenedProperty": "stone_brick_type",
            "suffix": "stone_bricks",
            "flattenedValueRemaps": {
                "chiseled": "chiseled_",
                "cracked": "cracked_",
                "default": "",
                "mossy": "mossy_",
                "smooth": ""
            }
        }
    },
    "remappedStates": {
        "minecraft:coral_fan_hang": [
            {
                "oldState": {
                    "dead_bit": {
                        "byte": 0
                    }
                },
                "newFlattenedName": {
                    "prefix": "minecraft:",
                    "flattenedProperty": "coral_hang_type_bit",
                    "flattenedPropertyType": "byte",
                    "suffix": "_coral_wall_fan",
                    "flattenedValueRemaps": {
                        "0": "tube",
                        "1": "brain",
                        "dummy": "map_not_list"
                    }
                },
                "newState": null,
                "copiedState": [
                    "coral_direction"
                ]
            },
            {
                "oldState": {
                    "dead_bit": {
                        "byte": 1
                    }
                },
                "newFlattenedName": {
                    "prefix": "minecraft:dead_",
                    "flattenedProperty": "coral_hang_type_bit",
                    "flattenedPropertyType": "byte",
                    "suffix": "_coral_wall_fan",
                    "flattenedValueRemaps": {
                        "0": "tube",
                        "1": "brain",
                        "dummy": "map_not_list"
                    }
                },
                "newState": null,
                "copiedState": [
                    "coral_direction"
                ]
            }
        ],
        "minecraft:coral_fan_hang2": [
            {
                "oldState": {
                    "dead_bit": {
                        "byte": 0
                    }
                },
                "newFlattenedName": {
                    "prefix": "minecraft:",
                    "flattenedProperty": "coral_hang_type_bit",
                    "flattenedPropertyType": "byte",
                    "suffix": "e_coral_wall_fan",
                    "flattenedValueRemaps": {
                        "0": "bubbl",
                        "1": "fir",
                        "dummy": "map_not_list"
                    }
                },
                "newState": null,
                "copiedState": [
                    "coral_direction"
                ]
            },
            {
                "oldState": {
                    "dead_bit": {
                        "byte": 1
                    }
                },
                "newFlattenedName": {
                    "prefix": "minecraft:dead_",
                    "flattenedProperty": "coral_hang_type_bit",
                    "flattenedPropertyType": "byte",
                    "suffix": "e_coral_wall_fan",
                    "flattenedValueRemaps": {
                        "0": "bubbl",
                        "1": "fir",
                        "dummy": "map_not_list"
                    }
                },
                "newState": null,
                "copiedState": [
                    "coral_direction"
                ]
            }
        ]
    }
}
